{
  "$schema": "http://json-schema.org/draft-07/schema#",
  "$id": "https://coachcoo.app/schemas/routine.schema.json",
  "title": "Routine",
  "type": "object",
  "required": ["id", "title", "steps"],
  "additionalProperties": false,
  "properties": {
    "id": { "type": "string", "minLength": 1 },
    "title": { "type": "string", "minLength": 1 },
    "globals": {
      "type": "object",
      "additionalProperties": false,
      "properties": {
        "listen": {
          "type": "object",
          "additionalProperties": false,
          "properties": {
            "timeoutMs": { "type": "number", "minimum": 0 }
          }
        },
        "reinforcement": {
          "type": "object",
          "additionalProperties": true
        }
      }
    },
    "steps": {
      "type": "array",
      "minItems": 1,
      "items": { "$ref": "#/definitions/step" }
    }
  },
  "definitions": {
    "prompt": {
      "type": "object",
      "additionalProperties": false,
      "properties": {
        "anim": { "type": "string" },
        "tts": { "type": "string" },
        "ttsVariants": {
          "type": "array",
          "minItems": 1,
          "items": {
            "type": "object",
            "required": ["text"],
            "additionalProperties": false,
            "properties": {
              "text": { "type": "string", "minLength": 1 },
              "weight": { "type": "number", "minimum": 0 }
            }
          }
        },
        "ssml": { "type": "boolean" }
      }
    },
    "listen": {
      "type": "object",
      "additionalProperties": false,
      "properties": {
        "timeoutMs": { "type": "number", "minimum": 0 },
        "keywords": {
          "type": "array",
          "minItems": 1,
          "items": { "type": "string", "minLength": 1 }
        }
      }
    },
    "branch": {
      "type": "object",
      "additionalProperties": false,
      "properties": {
        "next": { "type": "string", "minLength": 1 },
        "retry": {
          "type": "object",
          "additionalProperties": false,
          "properties": {
            "max": { "type": "number", "minimum": 1 },
            "promptOverride": { "$ref": "#/definitions/prompt" }
          }
        },
        "celebrate": { "$ref": "#/definitions/prompt" },
        "reward": {
          "type": "object",
          "additionalProperties": false,
          "properties": {
            "points": { "type": "number" },
            "sticker": { "type": "string" }
          }
        }
      }
    },
    "shaping": {
      "type": "object",
      "additionalProperties": false,
      "properties": {
        "requiredSuccesses": { "type": "number", "minimum": 1 },
        "maxAttempts": { "type": "number", "minimum": 1 }
      }
    },
    "step": {
      "type": "object",
      "required": ["id", "prompt"],
      "additionalProperties": false,
      "properties": {
        "id": { "type": "string", "minLength": 1 },
        "prompt": { "$ref": "#/definitions/prompt" },
        "listen": { "$ref": "#/definitions/listen" },
        "onHeard": { "$ref": "#/definitions/branch" },
        "onTimeout": { "$ref": "#/definitions/branch" },
        "shaping": { "$ref": "#/definitions/shaping" }
      }
    }
  }
}
